{
  "schema_version": "1.1",
  "project_id": "7b88e805-9cdc-4557-b4ce-fa19dffd03db",
  "scene_hash": "88039d3a2454ed4d228df14c0595f17646703ab3a03809e8873649508f9d3f99",
  "camera": {
    "position": {
      "x": 11574.259657187682,
      "y": -5074.259657187683,
      "z": 5269.259657187683
    },
    "target": {
      "x": 6400.0,
      "y": 100.0,
      "z": 95.0
    },
    "up": {
      "x": -0.408248290463863,
      "y": 0.408248290463863,
      "z": 0.816496580927726
    },
    "projection": "perspective",
    "field_of_view_deg": 45.0,
    "ortho_scale": 6117.845581575266,
    "near_plane": 0.1,
    "far_plane": 34568.02524009724,
    "coordinate_system": "world",
    "version": 1
  },
  "selection_level": "part",
  "selected_node_ids": [
    "entity:P1",
    "entity:P2"
  ],
  "hidden_node_ids": [],
  "isolation_node_ids": [],
  "ghost_context": false,
  "transparency_by_node": [],
  "color_by_node": [],
  "display_preferences": {
    "render_mode": "shaded_edges",
    "color_scheme": "original",
    "background_theme": "light",
    "ghost_opacity": 0.12,
    "selection_color": {
      "red": 1.0,
      "green": 0.82,
      "blue": 0.0,
      "alpha": 1.0
    },
    "edge_width": 0.65,
    "show_selection_outline": true,
    "version": 1
  },
  "section_planes": [],
  "clipping_box": null,
  "viewpoints": [],
  "visibility_sets": [],
  "explode_offsets": [],
  "measurements": [
    {
      "measurement_id": "measurement-8803976b-fee0-41e0-b3ca-b78bfd9564f2",
      "kind": "distance",
      "value": 9900.0,
      "unit": "mm",
      "formatted_text": "9900 mm",
      "anchors": [
        {
          "node_id": "entity:P1",
          "entity_id": "P1",
          "source_entity_id": "",
          "feature_id": null,
          "subshape_type": null,
          "subshape_id": null,
          "world_point": {
            "x": 1500.0,
            "y": 100.0,
            "z": 95.0
          },
          "local_point": {
            "x": 1500.0,
            "y": 100.0,
            "z": 95.0
          },
          "geometry_hash": "513b6744319b3deb6e239e32ecc6f8d8e321259b1ad688222c526cf6ee512ea5",
          "snap_type": "center",
          "proof": "display_proxy",
          "direction": null,
          "normal": null,
          "analytical_data": {}
        },
        {
          "node_id": "entity:P2",
          "entity_id": "P2",
          "source_entity_id": "",
          "feature_id": null,
          "subshape_type": null,
          "subshape_id": null,
          "world_point": {
            "x": 11400.0,
            "y": 100.0,
            "z": 95.0
          },
          "local_point": {
            "x": 11400.0,
            "y": 100.0,
            "z": 95.0
          },
          "geometry_hash": "21c3a30b76f3071e5a27523b1d481176cf5bdeb90de179458b77f4219217848d",
          "snap_type": "center",
          "proof": "display_proxy",
          "direction": null,
          "normal": null,
          "analytical_data": {}
        }
      ],
      "validity_hash": "cc61b51664513bfa223a9d07bd10f5791eb0e3196a255c76a1eb590c0a8d14ee",
      "proof": "display_proxy",
      "name": "",
      "note": "",
      "visible": true,
      "status": "valid",
      "invalid_reason": "",
      "production_eligible": false,
      "metadata": {}
    }
  ],
  "measurement_settings": {
    "length_unit": "mm",
    "area_unit": "mm2",
    "volume_unit": "mm3",
    "angle_unit": "deg",
    "mass_unit": "kg",
    "precision": 3,
    "trailing_zeroes": false
  },
  "accuracy_mode": false,
  "active_viewpoint_id": null,
  "created_at": "2026-09-12T11:43:55+00:00",
  "updated_at": "2026-09-12T11:43:55+00:00",
  "state_hash": "08abac58451b07fe0e41b856e838ba3b9855854b2e29669c4c9a942c1dde0928"
}