{
  "schema_version": "1.1",
  "project_id": "7582d75e-4b73-4cbb-8918-ffee63d7b37d",
  "scene_hash": "b32c8ef159d9e0336256d0a5208619e30f44640407aa7743cddd810064ac95ce",
  "camera": {
    "position": {
      "x": 11574.259657187682,
      "y": -5074.259657187683,
      "z": 5269.259657187683
    },
    "target": {
      "x": 6400.0,
      "y": 100.0,
      "z": 95.0
    },
    "up": {
      "x": -0.408248290463863,
      "y": 0.408248290463863,
      "z": 0.816496580927726
    },
    "projection": "perspective",
    "field_of_view_deg": 45.0,
    "ortho_scale": 6117.845581575266,
    "near_plane": 0.1,
    "far_plane": 34568.02524009724,
    "coordinate_system": "world",
    "version": 1
  },
  "selection_level": "part",
  "selected_node_ids": [
    "entity:P1"
  ],
  "hidden_node_ids": [],
  "isolation_node_ids": [],
  "ghost_context": false,
  "transparency_by_node": [],
  "color_by_node": [],
  "display_preferences": {
    "render_mode": "shaded_edges",
    "color_scheme": "original",
    "background_theme": "light",
    "ghost_opacity": 0.12,
    "selection_color": {
      "red": 1.0,
      "green": 0.82,
      "blue": 0.0,
      "alpha": 1.0
    },
    "edge_width": 0.65,
    "show_selection_outline": true,
    "version": 1
  },
  "section_planes": [
    {
      "plane_id": "section-a92c73e9-77df-409b-9ca0-e9e04410beb2",
      "origin": {
        "x": 1500.0,
        "y": 100.0,
        "z": 95.0
      },
      "normal": {
        "x": 0.0,
        "y": 0.0,
        "z": 1.0
      },
      "enabled": true,
      "flipped": false,
      "cap_mode": "none",
      "display_color": {
        "red": 0.15,
        "green": 0.55,
        "blue": 0.95,
        "alpha": 0.65
      },
      "owner": "BOM W03",
      "coordinate_system": "world"
    }
  ],
  "clipping_box": null,
  "viewpoints": [],
  "visibility_sets": [],
  "explode_offsets": [],
  "measurements": [],
  "measurement_settings": {
    "length_unit": "mm",
    "area_unit": "mm2",
    "volume_unit": "mm3",
    "angle_unit": "deg",
    "mass_unit": "kg",
    "precision": 3,
    "trailing_zeroes": false
  },
  "accuracy_mode": false,
  "active_viewpoint_id": null,
  "created_at": "2026-09-12T11:43:55+00:00",
  "updated_at": "2026-09-12T11:43:55+00:00",
  "state_hash": "d9b2b711b789184e1d7cbfd07466231fa2b953fa056a913eec2a7c8822a320c3"
}